<?xml version="1.0" encoding="UTF-8"?>
<Root xmlns:xsi="http://www.w3.org/2001/XMLSchema-instance" xsi:noNamespaceSchemaLocation="uiColumn.xsd">
	<Column columnName="程序名称" field="filename" align="center" width="200"  isSort="true"/>
	<Column columnName="机构ID" field="unitid" align="center" width="100"  isSort="true"/>
	<Column columnName="商户ID" field="branchid" align="center" width="100"  isSort="true"/>
	<Column columnName="商户序号" field="merseq" align="center" width="100"  isSort="true"/>
	<Column columnName="pos品牌" field="posbrand" align="center" width="100"  isSort="true" formatter="posbrandDesc"/>
	<Column columnName="存放目录" field="filepath" align="center" width="300"  isSort="true"/>
	<Column columnName="版本号" field="version" align="center" width="100"  isSort="true"/>
	<Column columnName="程序大小" field="filesize" align="center" width="100"  isSort="true"/>
	<Column columnName="程序功能" field="filefunc" align="center" width="100"  isSort="true"/>
</Root>
